"grammar","primitive_composition","examples","notes"
"diagnostic","context; manifestations; origins; propagation; control points; calibration","EDF; Five Whys; RCA","Supports structured causal reasoning"
"situational assessment","factors; categories; pressures; positions","SWOT; PESTLE; Wardley Mapping","Current-state emphasis"
"decision","options; criteria; tradeoffs; priorities","Decision Matrix; MoSCoW; Kepner-Tregoe","Choice and prioritization grammar"
"planning / alignment","objectives; measures; initiatives; review loops","OKRs; SMART Goals; Hoshin Kanri","Alignment toward outcomes"
"execution / flow","work items; states; cadence; constraints","Scrum; Kanban; GTD","Practice and flow dominate"
"design / discovery","users; needs; hypotheses; experiments","Lean Startup; Design Thinking; JTBD","Creation and discovery focus"
"governance / control","roles; authority; controls; obligations","RACI; DACI; COSO","Authority and control emphasis"
"learning / evaluation","levels; criteria; evidence; outcomes","Bloom's Taxonomy; Kirkpatrick; CIPP","Evaluation-oriented structure"
